{
  "action_contract_id": "robot.tank.pick",
  "analysis_scope": "robot-arm-after-anchor-and-rail-settle",
  "contract_digest": "e5879b0efd2f194a127919f31e645ba3fedc2d58321c3dc991d13a24f73ce4fc",
  "mode": "shadow",
  "preconditions": [
    "robot-anchor:P1",
    "rail-slot:5-settled",
    "controller-tool:1",
    "operation-prologue-and-rail-motion-excluded-from-this-scope"
  ],
  "resolution": {
    "status": "unresolved",
    "unresolved_reasons": [
      "controller-interpolation-unresolved",
      "cp-blend-unresolved",
      "continuous-collision-not-computed",
      "stop-model-missing"
    ],
    "waypoint_sequence_resolved": true
  },
  "sample_id": "eit-ptlc-historical-v1",
  "schema": "lab.motion-contract/v0",
  "selector": {
    "tank_id": 1
  },
  "source_digests": {
    "robot-calibration": "582c0472c4bae565c87443b0252578fdd2f1092e24790c29ea5ffd360efc97fa",
    "robot-points": "d4d8a03ee3e9dfb248c6d9eee69b12d69a7069d41aaf9fadada644fd7cd14c00",
    "tank-pick-operation": "9961a8063e16d4b6237d598f11e045872c3d6b61335946877d9c3693f2b52f85",
    "tank1-pick-compiled-clip": "b7eda74614e24d94c1eeaddae28b8288e11457be995e36527f9f7009b583dde3"
  },
  "steps": [
    {
      "index": 0,
      "kind": "tool-state",
      "payload_state_after": "empty",
      "payload_state_before": "empty",
      "phase": "approach",
      "tool_action": "rotary-down"
    },
    {
      "acc": 18.0,
      "cp": 0.0,
      "index": 1,
      "joint_deg": [
        -170.915009,
        -33.012058,
        97.498688,
        26.337778,
        -89.878792,
        -118.517677
      ],
      "joint_resolution_note": "measured-joint",
      "joint_source": "joint",
      "kind": "robot-motion",
      "motion": "move_j",
      "payload_state_after": "empty",
      "payload_state_before": "empty",
      "phase": "approach",
      "point_ref": "P75",
      "point_status": "validated",
      "rail_slot": null,
      "selected_joint_pose_residual_mm": 0.133472117268,
      "semantic_point_id": "robot-main.area-2-3ready",
      "stored_joint_pose_residual_mm": 0.133472117268,
      "tcp_pose_controller": [
        133.974899,
        197.583176,
        400.003021,
        -179.519745,
        0.73442,
        37.763584
      ],
      "tool": 1,
      "user": 0,
      "vel": 30.0
    },
    {
      "acc": 18.0,
      "cp": 0.0,
      "index": 2,
      "joint_deg": [
        -139.337311,
        -34.835484,
        96.256699,
        29.404808,
        -89.935883,
        -122.530746
      ],
      "joint_resolution_note": "measured-joint",
      "joint_source": "joint",
      "kind": "robot-motion",
      "motion": "move_j",
      "payload_state_after": "empty",
      "payload_state_before": "empty",
      "phase": "approach",
      "point_ref": "P84",
      "point_status": "validated",
      "rail_slot": null,
      "selected_joint_pose_residual_mm": 0.115780262967,
      "semantic_point_id": "robot-main.area-2-4ready",
      "stored_joint_pose_residual_mm": 0.115780262967,
      "tcp_pose_controller": [
        -4.096268,
        221.846344,
        409.40271,
        -179.520554,
        0.733468,
        73.350761
      ],
      "tool": 1,
      "user": 0,
      "vel": 30.0
    },
    {
      "acc": 60.0,
      "cp": 20.0,
      "index": 3,
      "joint_deg": [
        -58.86940002441406,
        -26.90290069580078,
        96.57679748535156,
        21.137500762939453,
        -89.79989624023438,
        -112.2406997680664
      ],
      "joint_resolution_note": "measured-joint",
      "joint_source": "joint",
      "kind": "robot-motion",
      "motion": "move_j",
      "payload_state_after": "empty",
      "payload_state_before": "empty",
      "phase": "approach",
      "point_ref": "P59",
      "point_status": "validated",
      "rail_slot": null,
      "selected_joint_pose_residual_mm": 0.166725756774,
      "semantic_point_id": "robot-main.area-2-2ready",
      "stored_joint_pose_residual_mm": 0.166725756774,
      "tcp_pose_controller": [
        -265.968597,
        95.430435,
        393.066925,
        -179.519745,
        0.734396,
        143.54277
      ],
      "tool": 1,
      "user": 0,
      "vel": 50.0
    },
    {
      "acc": 18.0,
      "cp": 0.0,
      "index": 4,
      "joint_deg": [
        -24.176685,
        13.452963,
        81.87381,
        -5.909149,
        -89.154348,
        -92.144859
      ],
      "joint_resolution_note": "software-derived-point-joint",
      "joint_source": "jointSolved",
      "kind": "robot-motion",
      "motion": "move_l",
      "payload_state_after": "empty",
      "payload_state_before": "empty",
      "phase": "approach",
      "point_ref": "tank.1.approach_far",
      "point_status": "validated",
      "rail_slot": 5,
      "selected_joint_pose_residual_mm": 4.24571e-06,
      "semantic_point_id": "tank.1.approach_far",
      "stored_joint_pose_residual_mm": null,
      "tcp_pose_controller": [
        -582.941329,
        51.52619100000001,
        273.669571,
        -178.910187,
        -0.800248,
        158.130737
      ],
      "tool": 1,
      "user": 0,
      "vel": 30.0
    },
    {
      "acc": 12.0,
      "cp": 2.0,
      "index": 5,
      "joint_deg": [
        -24.176685,
        34.246377,
        108.924684,
        -53.753437,
        -89.154348,
        -92.144859
      ],
      "joint_resolution_note": "software-derived-point-joint",
      "joint_source": "jointSolved",
      "kind": "robot-motion",
      "motion": "move_l",
      "payload_state_after": "empty",
      "payload_state_before": "empty",
      "phase": "approach",
      "point_ref": "tank.1.approach_mid",
      "point_status": "validated",
      "rail_slot": 5,
      "selected_joint_pose_residual_mm": 4.223383e-06,
      "semantic_point_id": "tank.1.approach_mid",
      "stored_joint_pose_residual_mm": null,
      "tcp_pose_controller": [
        -582.941329,
        51.52619100000001,
        -41.330429,
        -178.910187,
        -0.800248,
        158.130737
      ],
      "tool": 1,
      "user": 0,
      "vel": 15.0
    },
    {
      "acc": 6.0,
      "cp": 0.0,
      "index": 6,
      "joint_deg": [
        2.073072,
        35.530638,
        106.417722,
        -52.937389,
        -89.553975,
        -65.894998
      ],
      "joint_resolution_note": "software-derived-point-joint",
      "joint_source": "jointSolved",
      "kind": "robot-motion",
      "motion": "move_l",
      "payload_state_after": "empty",
      "payload_state_before": "empty",
      "phase": "approach",
      "point_ref": "tank.1.approach_near",
      "point_status": "validated",
      "rail_slot": 5,
      "selected_joint_pose_residual_mm": 4.72076e-06,
      "semantic_point_id": "tank.1.approach_near",
      "stored_joint_pose_residual_mm": null,
      "tcp_pose_controller": [
        -582.941329,
        -215.473809,
        -41.330429,
        -178.910187,
        -0.800248,
        158.130737
      ],
      "tool": 1,
      "user": 0,
      "vel": 10.0
    },
    {
      "acc": 6.0,
      "cp": 0.0,
      "index": 7,
      "joint_deg": [
        2.07307192,
        37.20467624,
        106.7679667,
        -54.96167228,
        -89.55397517,
        -65.89499757
      ],
      "joint_resolution_note": "stale-measured-joint-rejected",
      "joint_source": "compiledMoveLTrajectory",
      "kind": "robot-motion",
      "motion": "move_l",
      "payload_state_after": "empty",
      "payload_state_before": "empty",
      "phase": "approach",
      "point_ref": "P11",
      "point_status": "validated",
      "rail_slot": 5,
      "selected_joint_pose_residual_mm": 6.7567e-08,
      "semantic_point_id": "robot-main.area-2-1",
      "stored_joint_pose_residual_mm": 22.399514293844,
      "tcp_pose_controller": [
        -582.941329,
        -215.473809,
        -56.330429,
        -178.910187,
        -0.800248,
        158.130737
      ],
      "tool": 1,
      "user": 0,
      "vel": 5.0
    },
    {
      "index": 8,
      "kind": "tool-state",
      "payload_state_after": "plate-attached",
      "payload_state_before": "empty",
      "phase": "acquire",
      "tool_action": "suction-on"
    },
    {
      "acc": 6.0,
      "cp": 0.0,
      "index": 9,
      "joint_deg": [
        2.073072,
        35.530638,
        106.417722,
        -52.937389,
        -89.553975,
        -65.894998
      ],
      "joint_resolution_note": "software-derived-point-joint",
      "joint_source": "jointSolved",
      "kind": "robot-motion",
      "motion": "move_l",
      "payload_state_after": "plate-attached",
      "payload_state_before": "plate-attached",
      "phase": "transfer",
      "point_ref": "tank.1.approach_near",
      "point_status": "validated",
      "rail_slot": 5,
      "selected_joint_pose_residual_mm": 4.72076e-06,
      "semantic_point_id": "tank.1.approach_near",
      "stored_joint_pose_residual_mm": null,
      "tcp_pose_controller": [
        -582.941329,
        -215.473809,
        -41.330429,
        -178.910187,
        -0.800248,
        158.130737
      ],
      "tool": 1,
      "user": 0,
      "vel": 10.0
    },
    {
      "acc": 18.0,
      "cp": 0.0,
      "index": 10,
      "joint_deg": [
        -24.176685,
        34.246377,
        108.924684,
        -53.753437,
        -89.154348,
        -92.144859
      ],
      "joint_resolution_note": "software-derived-point-joint",
      "joint_source": "jointSolved",
      "kind": "robot-motion",
      "motion": "move_l",
      "payload_state_after": "plate-attached",
      "payload_state_before": "plate-attached",
      "phase": "transfer",
      "point_ref": "tank.1.approach_mid",
      "point_status": "validated",
      "rail_slot": 5,
      "selected_joint_pose_residual_mm": 4.223383e-06,
      "semantic_point_id": "tank.1.approach_mid",
      "stored_joint_pose_residual_mm": null,
      "tcp_pose_controller": [
        -582.941329,
        51.52619100000001,
        -41.330429,
        -178.910187,
        -0.800248,
        158.130737